,"Audit",,,,,,
,71,2021-09-06,0.599050925928168,"Philip Swannell","Changes to method CastToDate",,
,70,2021-09-05,0.352592592593282,"Philip Swannell","Renamed functions sNRows -> NRows etc.",,
,69,2021-09-03,0.388055555558822,"Philip Swannell","HeaderRow now trimmed.",,
,68,2021-09-02,0.770393518519995,"Philip Swannell","Removed two old Performance sheets.",,
,67,2021-09-02,0.734490740738693,"Philip Swannell","Updated docstrings.",,
,66,2021-09-02,0.40944444444176,"Philip Swannell","Amending Tests",,
,65,2021-09-02,0.395509259258688,"Philip Swannell","Recovering from Git woes and their consequences for tests.",,
,64,2021-09-01,0.758078703700448,"Philip Swannell","Re-ran performance tests.",,
,63,2021-09-01,0.698912037034461,"Philip Swannell","Fixed compile errors when modCSVReadWrite is ""stand-alone"".",,
,62,2021-09-01,0.675393518518831,"Philip Swannell","Added 2 missing tests - 110 and 124.",,
,61,2021-09-01,0.645659722220444,"Philip Swannell","Deleted temporary sheets used during previous release.",,
,60,2021-09-01,0.645277777781303,"Philip Swannell","Changes to compile on 32bit.",,
,59,2021-09-01,0.440949074072705,"Philip Swannell","Code of modWrappers moved to modCSVPerformance",,
,58,2021-08-31,0.41174768518249,"Philip Swannell","Workbook now more ""portable"" i.e. folder locations all relative to the path of the workbook itself.",,
,57,2021-08-30,0.816145833334303,"Philip Swannell","Reinstated conditional formatting on sheet Demo.",,
,56,2021-08-30,0.770972222220735,"Philip Swannell","Deal with times with fractional seconds - CDate does not cope with them.",,
,55,2021-08-30,0.574131944442343,"Philip Swannell","Now test all possible responses to bad inputs.",,
,54,2021-08-30,0.32952546296292,"Philip Swannell","Reworked performance testing to include comparison with Julia.",,
,53,2021-08-28,0.659189814818092,"Philip Swannell","More tests and fixes to column-by-column formatting.",,
,52,2021-08-27,0.853576388886722,"Philip Swannell","Implemented Column-by-column type conversion",,
,51,2021-08-26,0.806435185186274,"Philip Swannell","Changes to sheet Demo.",,
,50,2021-08-26,0.801539351850806,"Philip Swannell","More refactoring.",,
,49,2021-08-26,0.770590277774318,"Philip Swannell","Refactoring",,
,48,2021-08-26,0.57442129629635,"Philip Swannell","Got rid of RetainQuotes option for ConvertTypes. ConvertTypes TRUE is now NDB rather than NDBE as previously.",,
,47,2021-08-26,0.572395833332848,"Philip Swannell","Now have two possibilities for DateFormat: ISO and ISOZ, the latter handles datetime with time zone.",,
,46,2021-08-25,0.010671296295186,"Philip Swannell","Added more tests.",,
,45,2021-08-24,0.820497685184819,"Philip Swannell","Added sheet ""RegExp"".",,
,44,2021-08-24,0.799525462964084,"Philip Swannell","Work on ISOO8601 date recognition.",,
,43,2021-08-24,0.432581018518249,"Philip Swannell","Sheet Demo no longer creates a file on disk.",,
,42,2021-08-24,0.403472222220444,"Philip Swannell","Work on ISOO8601 date recognition",,
,41,2021-08-21,0.793078703703941,"Philip Swannell","Added arguments TrueStrings, FalseStrings and MissingStrings .",,
,40,2021-08-21,0.496944444443216,"Philip Swannell","Added module modCVSSentinels, but not yet ""plugged in"".",,
,39,2021-08-20,0.523888888885267,"Philip Swannell","CSVRead now accepts FileName as URL or a CSV string.",,
,38,2021-08-20,0.375462962962047,"Philip Swannell","CSVWrite can now write to String.",,
,37,2021-08-19,0.808692129627161,"Philip Swannell","Now support UTf8 with BOM",,
,36,2021-08-19,0.745185185187438,"Philip Swannell","Now support ""T"" as a ConvertTypes option.",,
,35,2021-08-19,0.519201388888177,"Philip Swannell","More work on tests",,
,34,2021-08-18,0.846979166664823,"Philip Swannell","Removed modCVSTestAgainstExcel.",,
,33,2021-08-18,0.844432870369928,"Philip Swannell","New module modCSVTest",,
,32,2021-08-16,0.936377314814308,"Philip Swannell","New argument ""Comment"" to CSVRead.",,
,31,2021-08-16,0.491053240737529,"Philip Swannell","Changes to type conversion code. Now possible to convert quoted strings.",,
,30,2021-08-15,0.495937500003492,"Philip Swannell","Got capitalisation of functions CSVRead and CSVWrite called from cells correct. ",,
,29,2021-08-15,0.437638888892252,"Philip Swannell","More work on IgnoreRepeated.",,
,28,2021-08-15,0.334652777775773,"Philip Swannell","Added argument IgnoreRepeated.",,
,27,2021-08-13,0.841504629628616,"Philip Swannell","Reinstated conditional formatting on sheet Demo.",,
,26,2021-08-13,0.830983796295186,"Philip Swannell","Added a bunch of functions to modCSVTestDeps so that we no longer have dependency on SAI for testing.",,
,25,2021-08-13,0.730972222219862,"Philip Swannell","Removed Help sheet - broken out to separate workbook",,
,24,2021-08-13,0.711064814815472,"Philip Swannell","Help changes",,
,23,2021-08-12,0.8042824074073,"Philip Swannell","Work on Markdown help.",,
,22,2021-08-12,0.747812499997963,"Philip Swannell","Added argument ShowMissingsAs to CSVRead. Simplification of this workbook.",,
,21,2021-08-11,0.988541666665697,"Philip Swannell","Corrections to code comments.",,
,20,2021-08-11,0.981354166666279,"Philip Swannell","Code formatting.",,
,19,2021-08-11,0.822719907409919,"Philip Swannell","Method TimeThreeParsers now has TimeOut argument so that time to execute is averaged over the number of calls required to take (in total) the TimeOut value.",,
,18,2021-08-11,0.739756944443798,"Philip Swannell","Removed reference to SolumAddin.",,
,17,2021-08-11,0.708356481482042,"Philip Swannell","Renamed CSVRead_V3 as CSVRead",,
,16,2021-08-11,0.519606481480878,"Philip Swannell","Removed redundant modules. CSVWrite no longer has Ragged argument.",,
,15,2021-08-11,0.495775462964957,"Philip Swannell","Deleted functions CSVRead_V1 and CSVRead_V2",,
,14,2021-08-11,0.491747685184237,"Philip Swannell","Deleted 2 of the 3 sheets with timing results.",,
,13,2021-08-11,0.490347222221317,"Philip Swannell","Changed method SaveWorkbookAndExportModules to also save a backup to OneDrive.",,
,12,2021-08-11,0.481909722220735,"Philip Swannell","Bug fixes to handling of SkipNumRows etc.",,
,11,2021-08-10,0.954675925924676,"Philip Swannell","Added sheet `TimingResults (3)`",,
,10,2021-08-10,0.73436342592322,"Philip Swannell","CSVRead_V3 now supports SkipToRow and NumRows.",,
,9,2021-08-09,0.54605324073782,"Philip Swannell","CSVRead_V2 now supports SkipToCol and NumCols, not yet SkipToRow and NumRows though.",,
,8,2021-08-08,0.549398148148612,"Philip Swannell","Now have two functions CSVRead_V1 and CSVRead_V2",,
,7,2021-08-07,0.961377314815763,"Philip Swannell","Settled on fastest algo.",,
,6,2021-08-06,0.666076388886722,"Philip Swannell","Add sheet ""TimingResults"" and module modCompareAgainstAlternatives.",,
,5,2021-08-04,0.349120370367018,"Philip Swannell","Added code to compare against https://github.com/sdkn104/VBA-CSV",,
,4,2021-08-03,0.376828703701904,"Philip Swannell","Rewrote code to split a string, rather than examining each character in VBA code, use InStr in a while loop to push the character examination down to C code.",,
,3,2021-07-29,0.598425925927586,"Philip Swannell","Code now compiles.",,
,2,2021-07-29,0.576770833336923,"Philip Swannell","Reimported sFileSaveCSV and sFileShow from SolumAddin version 2199. Code does not yet compile",,
,1,2021-07-23,0.58872685184906,"Philip Swannell","First version. Start with SolumAddin's sFileShow to create CSVParse.",,
